{
  "schema_version": "1.0",
  "project_id": "clr-2026-large-print-sudoku-for-seniors-easy-puzzles-with",
  "title": "Large Print Sudoku for Seniors: Easy Puzzles with Solutions",
  "subtitle": null,
  "series": null,
  "language": "en-US",
  "contributors": [
    {
      "name": "Clarity Press",
      "role": "publisher"
    }
  ],
  "audience": {
    "band": "senior-large-print",
    "age_min": 55,
    "age_max": null,
    "description": "Adults 55+ seeking accessible, large-print puzzle activity"
  },
  "description": "Large Print Sudoku for Seniors features 100 easy 9x9 sudoku puzzles designed for enjoyment and accessibility. Every puzzle is printed one per page at generous size with high-contrast black-on-white grids, making digits easy to read and cells easy to fill. All puzzles are solvable using straightforward logic — no guessing required. Complete answer keys are grouped at the back of the book so solvers can check their work without spoiling the puzzle pages. Whether you are new to sudoku or simply prefer a relaxed, forgiving challenge, this collection offers hours of calm, satisfying puzzle play. 100 unique puzzles. Back-of-book solutions. Large-print 8.5 x 11 format.",
  "short_description": "100 easy large-print sudoku puzzles for seniors — one per page, high-contrast grids, back-of-book solutions.",
  "keywords": [
    "large print sudoku for seniors",
    "easy sudoku puzzles",
    "sudoku for seniors",
    "large print puzzle book",
    "brain games for seniors",
    "sudoku with solutions",
    "easy sudoku book",
    "sudoku large print"
  ],
  "subjects": [
    "Humor & Entertainment / Puzzles & Games / Sudoku",
    "Games & Activities / Puzzles & Games"
  ],
  "edition": 1,
  "publication_date": null,
  "rights_statement": "Original puzzle content generated deterministically by code and independently verified. Cover design original. AI assistance used in content generation, cover build, and editorial development — disclosed per channel requirements. All rights reserved.",
  "identifiers": [],
  "formats": [
    "paperback"
  ],
  "accessibility": {
    "body_type_pt": 18.0,
    "high_contrast": true,
    "one_puzzle_per_page": true,
    "solutions_placement": "back-only",
    "trim_size": "8.5x11",
    "page_count": 202,
    "gate_decision": "PASS",
    "gate_artifact": "art-accessibility-gate-4ece5668b5fb"
  },
  "pricing": {
    "note": "Prices not set. To be determined at listing stage by publisher.",
    "product_type": "puzzle-book",
    "puzzle_types": ["sudoku-9x9"],
    "difficulty_range": "easy",
    "puzzle_count": 100,
    "colour_interior": false,
    "originals_only": true,
    "ai_assistance_disclosure_required": true
  },
  "disclosures": [
    "This book was produced with AI assistance. Puzzle content was generated by deterministic software and independently verified by code. Cover design and editorial content were developed with AI-assisted tools under human supervision and approval."
  ]
}
